{
  "evidence_refs": [
    "intent.json",
    "action.json",
    "result.json",
    "trace.json",
    "receipt.json"
  ],
  "execution_trace_ref": "trace.json",
  "file_type": "result",
  "goal_satisfied": false,
  "mode": "evidence_chain",
  "notes": [
    "Budget and approval checks passed.",
    "Full intent, governance, integrity, and receipt chain."
  ],
  "outputs": {
    "artifact_directory": "artifacts/runs/task-015/evidence_chain",
    "expected_artifacts": [
      "intent.json",
      "action.json",
      "result.json",
      "trace.json",
      "receipt.json"
    ],
    "runtime_surface": "paper-local-evidence-chain",
    "simulated_response": {
      "category": "tamper_scenario",
      "estimated_cost_usd": 0.009,
      "estimated_tokens": 200,
      "operation": "tamper_sensitive_run",
      "requested_tool": "integrity_runner",
      "status": "tamper_detected",
      "target": "local://action-artifact"
    },
    "summary": "Detected a tamper condition while verifying Detect action digest mismatch."
  },
  "policy_outcome_ref": "action.json#/policy/decision",
  "run_id": "task-015-evidence_chain",
  "schema_version": "paper-eval.v1",
  "status": "tamper_detected",
  "task_id": "task-015"
}
