{
  "evidence_refs": [
    "intent.json",
    "action.json",
    "result.json",
    "trace.json",
    "receipt.json"
  ],
  "execution_trace_ref": "trace.json",
  "file_type": "result",
  "goal_satisfied": true,
  "mode": "baseline",
  "notes": [
    "Baseline mode exports a trace-only bundle without a persisted governance checkpoint.",
    "Trace-only local control path without persisted intent, governance, integrity, or receipt."
  ],
  "outputs": {
    "artifact_directory": "artifacts/runs/task-001/baseline",
    "expected_artifacts": [
      "intent.json",
      "action.json",
      "result.json",
      "trace.json",
      "receipt.json"
    ],
    "runtime_surface": "paper-local-baseline",
    "simulated_response": {
      "answer": "Persona, Intent, Governance, Trace, Audit",
      "category": "read_only_query",
      "estimated_cost_usd": 0.003,
      "estimated_tokens": 120,
      "operation": "read_local_summary",
      "requested_tool": "repo_reader",
      "status": "completed",
      "target": "README.md"
    },
    "summary": "Completed deterministic local run for Summarize architecture path."
  },
  "policy_outcome_ref": "action.json#/policy/decision",
  "run_id": "task-001-baseline",
  "schema_version": "paper-eval.v1",
  "status": "completed",
  "task_id": "task-001"
}
